{
  "$schema": "./schema/reference.schema.json",
  "updated": "2026-09-14",
  "note": {
    "th": "เอกสารเหล่านี้รวบรวมไว้เพื่อการศึกษาและอ้างอิง ลิขสิทธิ์เป็นของผู้จัดทำหรือหน่วยงานต้นสังกัดเดิม หากท่านเป็นเจ้าของเอกสารและต้องการให้แก้ไขข้อมูลหรือนำออก แจ้งได้ที่หน้าส่งข้อมูล",
    "en": "These documents are collected for study and reference. Copyright remains with the original authors and their institutions. If you own a document and would like it corrected or removed, please get in touch via the Submit page."
  },
  "categories": [
    {
      "id": "grid",
      "label": {
        "th": "ยุคกริด — ThaiGrid & TNGC",
        "en": "The grid era — ThaiGrid & TNGC"
      },
      "blurb": {
        "th": "เอกสารนำเสนอจากยุคที่ประเทศไทยสร้างระบบกริดเชื่อมมหาวิทยาลัยเข้าด้วยกัน",
        "en": "Presentations from the period when Thailand built a national grid linking its universities."
      }
    },
    {
      "id": "escience",
      "label": {
        "th": "National e-Science Infrastructure Consortium",
        "en": "National e-Science Infrastructure Consortium"
      },
      "blurb": {
        "th": "รายงานประจำปีของคอนซอร์เทียม — โฮสต์อยู่ที่ e-science.in.th ลิงก์ไปยังต้นฉบับโดยตรง",
        "en": "The consortium's annual reports — hosted at e-science.in.th; these link straight to the source."
      }
    },
    {
      "id": "systems",
      "label": {
        "th": "ระบบและคลัสเตอร์",
        "en": "Systems & clusters"
      },
      "blurb": {
        "th": "เอกสารเฉพาะเครื่อง ตั้งแต่ PIRUN ยุคบุกเบิกจนถึง TARA และ Krypton",
        "en": "Machine-specific documents, from the pioneering PIRUN through to TARA and Krypton."
      }
    },
    {
      "id": "national",
      "label": {
        "th": "ภาพรวมระดับประเทศ",
        "en": "National landscape"
      },
      "blurb": {
        "th": "สถานะและทิศทาง HPC / AI ของประเทศไทย จากเวทีวิชาการและการสำรวจ",
        "en": "The state and direction of HPC and AI in Thailand, from conference sessions and surveys."
      }
    },
    {
      "id": "research",
      "label": {
        "th": "งานวิจัย",
        "en": "Research papers"
      },
      "blurb": {
        "th": "บทความวิชาการที่เกี่ยวข้องกับ HPC ในบริบทของประเทศไทย",
        "en": "Academic papers relating to HPC in a Thai context."
      }
    },
    {
      "id": "web",
      "label": {
        "th": "หน้าเว็บที่บันทึกไว้",
        "en": "Archived web pages"
      },
      "blurb": {
        "th": "สำเนาหน้าเว็บที่เก็บไว้กันสูญหาย เนื้อหาตามต้นฉบับ ณ วันที่บันทึก",
        "en": "Saved copies of web pages, preserved as they stood on the day they were archived."
      }
    }
  ],
  "documents": [
    {
      "id": "access-grid-thailand",
      "category": "grid",
      "title": {
        "th": "Access Grid in Thailand",
        "en": "Access Grid in Thailand"
      },
      "description": {
        "th": "การนำ Access Grid มาใช้ในประเทศไทย นำเสนอที่ Access Grid Workshop ในการประชุม APAN เมืองปูซาน เกาหลีใต้ สิงหาคม 2546",
        "en": "Deploying Access Grid in Thailand — presented at the Access Grid Workshop, APAN meeting, Busan, South Korea, August 2003."
      },
      "file": "reference/docs/Access Grid in Thailand.pdf",
      "format": "pdf",
      "pages": 13,
      "bytes": 479404,
      "tags": [
        "Access Grid",
        "Collaboration"
      ],
      "year": 2003,
      "author": "Putchong Uthayopas"
    },
    {
      "id": "opensce",
      "category": "grid",
      "title": {
        "th": "OpenSCE — Middleware and Tools set for Cluster and Grid System",
        "en": "OpenSCE — Middleware and Tools set for Cluster and Grid System"
      },
      "description": {
        "th": "ชุดมิดเดิลแวร์และเครื่องมือสำหรับคลัสเตอร์และกริดที่พัฒนาในประเทศไทย ต่อยอดจากงาน SMILE นำเสนอที่ Gridbus2003 มหาวิทยาลัยเมลเบิร์น",
        "en": "A Thai-developed middleware and tool set for clusters and grids, growing out of the SMILE work — presented at Gridbus2003, University of Melbourne."
      },
      "file": "reference/docs/OpenSCE Middleware and Tools set  for Cluster and Grid System.pdf",
      "format": "pdf",
      "pages": 43,
      "bytes": 1357119,
      "tags": [
        "OpenSCE",
        "SMILE",
        "KU",
        "Open Source"
      ],
      "year": 2003,
      "author": "Putchong Uthayopas"
    },
    {
      "id": "gistda-grid",
      "category": "grid",
      "title": {
        "th": "Activities on Grid Technology at GISTDA",
        "en": "Activities on Grid Technology at GISTDA"
      },
      "author": "Pakorn Apaphant, Ph.D.",
      "description": {
        "th": "กิจกรรมด้านเทคโนโลยีกริดของ GISTDA นำเสนอในการประชุม 18th WGISS ณ กรุงปักกิ่ง กันยายน 2547",
        "en": "GISTDA's grid technology work, presented at the 18th WGISS Meeting in Beijing, September 2004."
      },
      "file": "reference/docs/Activities on Grid Technology at GISTDA.pdf",
      "format": "pdf",
      "pages": 13,
      "bytes": 460525,
      "tags": [
        "GISTDA",
        "Grid"
      ],
      "year": 2004
    },
    {
      "id": "recent-development-escience-grid",
      "category": "grid",
      "title": {
        "th": "Recent Development of e-Science & Grid in Thailand",
        "en": "Recent Development of e-Science & Grid in Thailand"
      },
      "author": "Piyawut Srichaikul, Putchong Uthayopas",
      "description": {
        "th": "รายงานความคืบหน้าของงาน e-Science และกริดในประเทศไทย ลงวันที่ 24 มกราคม 2549 โดย NECTEC ร่วมกับ มหาวิทยาลัยเกษตรศาสตร์",
        "en": "A progress report on e-Science and grid work in Thailand, dated 24 January 2006, from NECTEC together with Kasetsart University."
      },
      "file": "reference/docs/Recent development of e-Science & Grid in Thailand.pdf",
      "format": "pdf",
      "pages": 14,
      "bytes": 1737001,
      "tags": [
        "e-Science",
        "Grid"
      ],
      "year": 2006
    },
    {
      "id": "thaigrid-intro",
      "category": "grid",
      "title": {
        "th": "Introduction to Thai National Grid Project",
        "en": "Introduction to Thai National Grid Project"
      },
      "description": {
        "th": "เอกสารแนะนำโครงการไทยกริดแห่งชาติ (TNGP) โดยศูนย์ไทยกริดแห่งชาติ ภายใต้ SIPA กระทรวงเทคโนโลยีสารสนเทศและการสื่อสาร",
        "en": "An introduction to the Thai National Grid Project (TNGP) from the Thai National Grid Center, under SIPA, Ministry of Information and Communication Technology."
      },
      "file": "reference/docs/Thailand_Introduction_to_Thai_National_Grid_Project.pdf",
      "format": "pdf",
      "pages": 19,
      "bytes": 1203834,
      "tags": [
        "ThaiGrid",
        "TNGP"
      ],
      "year": 2006
    },
    {
      "id": "thaigrid-current-status",
      "category": "grid",
      "title": {
        "th": "ThaiGrid: Preliminary Studies on Thai's High Performance Computing Infrastructure",
        "en": "ThaiGrid: Preliminary Studies on Thai's High Performance Computing Infrastructure"
      },
      "author": "Vara Varavithya, Putchong Uthayopas",
      "description": {
        "th": "การศึกษาเบื้องต้นเกี่ยวกับโครงสร้างพื้นฐาน HPC ของไทย และสถานะของ ThaiGrid ในขณะนั้น",
        "en": "A preliminary study of Thailand's HPC infrastructure and the status of ThaiGrid at the time."
      },
      "file": "reference/docs/ThaiGrid- Current Status.pdf",
      "format": "pdf",
      "pages": 21,
      "bytes": 1153382,
      "tags": [
        "ThaiGrid",
        "KMUTNB"
      ]
    },
    {
      "id": "thaigrid-escience",
      "category": "grid",
      "title": {
        "th": "ThaiGrid and e-Science in Thailand",
        "en": "ThaiGrid and e-Science in Thailand"
      },
      "description": {
        "th": "เอกสารนำเสนอที่เชื่อมโยงงาน ThaiGrid เข้ากับทิศทาง e-Science ของประเทศ",
        "en": "A presentation connecting the ThaiGrid effort to the country's e-Science direction."
      },
      "file": "reference/docs/ThaiGrid and E-science in Thailand.pdf",
      "format": "pdf",
      "pages": 40,
      "bytes": 4505374,
      "tags": [
        "ThaiGrid",
        "e-Science"
      ]
    },
    {
      "id": "tngc-development",
      "category": "grid",
      "title": {
        "th": "The Development of the Thai National Grid Center",
        "en": "The Development of the Thai National Grid Center"
      },
      "description": {
        "th": "พัฒนาการของศูนย์ไทยกริดแห่งชาติ (TNGC) ตั้งแต่การจัดตั้งจนถึงการให้บริการ",
        "en": "How the Thai National Grid Center (TNGC) came together, from establishment through to service."
      },
      "file": "reference/docs/The Development of the Thai National Grid Center.pdf",
      "format": "pdf",
      "pages": 27,
      "bytes": 2331350,
      "tags": [
        "TNGC",
        "ThaiGrid"
      ],
      "author": "Dr. Tiranee Achalakul"
    },
    {
      "id": "escience-2013",
      "category": "escience",
      "year": 2013,
      "title": {
        "th": "รายงานประจำปี e-Science 2013",
        "en": "e-Science Annual Report 2013"
      },
      "description": {
        "th": "รายงานประจำปีของ National e-Science Infrastructure Consortium",
        "en": "Annual report of the National e-Science Infrastructure Consortium."
      },
      "url": "http://www.e-science.in.th/%e0%b8%94%e0%b8%b2%e0%b8%a7%e0%b8%99%e0%b9%8c%e0%b9%82%e0%b8%ab%e0%b8%a5%e0%b8%94/#sub12",
      "format": "link",
      "pages": 34,
      "tags": [
        "e-Science",
        "Annual report"
      ]
    },
    {
      "id": "escience-2015",
      "category": "escience",
      "year": 2015,
      "title": {
        "th": "รายงานประจำปี e-Science 2015",
        "en": "e-Science Annual Report 2015"
      },
      "description": {
        "th": "รายงานประจำปีของ National e-Science Infrastructure Consortium",
        "en": "Annual report of the National e-Science Infrastructure Consortium."
      },
      "url": "http://www.e-science.in.th/%e0%b8%94%e0%b8%b2%e0%b8%a7%e0%b8%99%e0%b9%8c%e0%b9%82%e0%b8%ab%e0%b8%a5%e0%b8%94/#sub12",
      "format": "link",